<?xml version="1.0" encoding="UTF-8"?>
<createTransactionRequest xmlns:xsi="http://www.w3.org/2001/XMLSchema-instance" xsi:noNamespaceSchemaLocation="DebitCardTransactions.xsd">
  <merchantAuthentication>
    <name>name</name>
    <transactionKey>transactionKey</transactionKey>
  </merchantAuthentication>
  <refId>0</refId>
  <transactionRequest>
    <transactionType>transactionType</transactionType>
    <amount>0</amount>
    <payment>
      <bankAccount>
        <accountType>accountType</accountType>
        <routingNumber>0</routingNumber>
        <accountNumber>0</accountNumber>
        <nameOnAccount>nameOnAccount</nameOnAccount>
      </bankAccount>
    </payment>
    <order>
      <invoiceNumber>invoiceNumber</invoiceNumber>
      <description>description</description>
    </order>
    <lineItems>
      <lineItem>
        <itemId>0</itemId>
        <name>name</name>
        <description>description</description>
        <quantity>0</quantity>
        <unitPrice>0</unitPrice>
      </lineItem>
    </lineItems>
    <tax>
      <amount>0.0</amount>
      <name>name</name>
      <description>description</description>
    </tax>
    <duty>
      <amount>0.0</amount>
      <name>name</name>
      <description>description</description>
    </duty>
    <shipping>
      <amount>0.0</amount>
      <name>name</name>
      <description>description</description>
    </shipping>
    <poNumber>0</poNumber>
    <billTo>
      <firstName>firstName</firstName>
      <lastName>lastName</lastName>
      <company>company</company>
      <address>address</address>
      <city>city</city>
      <state>state</state>
      <zip>0</zip>
      <country>country</country>
    </billTo>
    <shipTo>
      <firstName>firstName</firstName>
      <lastName>lastName</lastName>
      <company>company</company>
      <address>address</address>
      <city>city</city>
      <state>state</state>
      <zip>0</zip>
      <country>country</country>
    </shipTo>
    <customerIP>customerIP</customerIP>
  </transactionRequest>
</createTransactionRequest>
